{
  "format_version": 1,
  "category": "query",
  "category_title": {
    "zh_CN": "状态查询",
    "zh_HK": "狀態查詢",
    "en": "Queries",
    "es": "Consultas",
    "ja": "状態照会"
  },
  "id": "radar_angle",
  "order": 152,
  "title": {
    "zh_CN": "目标角度",
    "zh_HK": "目標角度",
    "en": "Target Angle",
    "es": "Ángulo del objetivo",
    "ja": "対象の角度"
  },
  "description": {
    "zh_CN": "读取扫描快照中目标相对于扫描雷达的方向角。先检查 target != null，再读取 Angle()；0° 向右、90° 向上、180° 向左、270° 向下。结果为数字，可用作动作角度或数值比较。Angle 区分大小写。",
    "zh_HK": "讀取掃描快照中，目標相對於掃描雷達的方向角。先檢查 target != null，再讀取 Angle()；0° 向右、90° 向上、180° 向左、270° 向下。結果為數字，可用作動作角度或數值比較。Angle 區分大小寫。",
    "en": "Reads the target direction relative to the scanning radar from a scan snapshot. Check target != null before reading Angle(). Directions are 0° right, 90° up, 180° left, and 270° down. The result is numeric and can be used as an action angle or in a comparison. Angle is case-sensitive.",
    "es": "Lee la dirección del objetivo respecto al radar que lo escaneó, a partir de la instantánea. Comprueba target != null antes de leer Angle(). Las direcciones son 0° a la derecha, 90° arriba, 180° a la izquierda y 270° abajo. El resultado es numérico y puede usarse como ángulo de una acción o en comparaciones. Angle distingue mayúsculas y minúsculas.",
    "ja": "スキャン時のスナップショットから、使用したレーダーに対する対象の方向角を読み取ります。先に target != null を確認してから Angle() を読みます。右が0°、上が90°、左が180°、下が270°です。結果は数値で、動作の角度や数値比較に使えます。Angle は大文字と小文字を区別します。"
  },
  "syntax": "target.Angle()",
  "requirements": {
    "allow_radar": true,
    "module_behavior": "RadarModule",
    "allow_variables": true
  }
}
