{
  "format_version": 1,
  "id": "named_attack",
  "order": 62,
  "category": "action",
  "category_title": {
    "zh_CN": "动作指令",
    "zh_HK": "動作指令",
    "en": "Actions",
    "es": "Acciones",
    "ja": "動作命令"
  },
  "title": {
    "zh_CN": "具名近战攻击",
    "zh_HK": "具名近戰攻擊",
    "en": "Named Melee Attack",
    "es": "Ataque cuerpo a cuerpo por nombre",
    "ja": "名前を指定した近接攻撃"
  },
  "description": {
    "zh_CN": "用组装页设置的近战模块名称替换 module。只有这个模块沿指定角度攻击，其他近战模块不会随之出手。射程从选中模块的实际中心计算，沿用该模块配置的射程与伤害；挥空也消耗一个逻辑 tick。需要本关开放具名调用。",
    "zh_HK": "用組裝頁設定的近戰模組名稱取代 module。只有該模組會沿指定角度攻擊，其他近戰模組不會一起出手。射程從所選模組的實際中心計算，沿用該模組設定的射程與傷害；揮空也會消耗一個邏輯 tick。需要本關開放具名呼叫。",
    "en": "Replace module with the melee module name assigned in assembly. Only this module attacks in the given direction; other melee modules do not strike. Reach starts at the selected module's actual center and uses its configured range and damage. A miss still takes one logic tick. Named calls must be unlocked for this level.",
    "es": "Sustituye module por el nombre del módulo de cuerpo a cuerpo asignado en el montaje. Solo ese módulo ataca en la dirección indicada; los demás módulos de cuerpo a cuerpo no atacan a la vez. El alcance se calcula desde el centro real del módulo elegido y usa su alcance y daño configurados. Fallar también consume un tick lógico. Las llamadas por nombre deben estar desbloqueadas en este nivel.",
    "ja": "module を組み立て画面で設定した近接攻撃モジュール名に置き換えます。このモジュールだけが指定角度に攻撃し、ほかの近接攻撃モジュールは動作しません。射程は指定したモジュールの実際の中心から計算し、射程とダメージにはそのモジュールの設定を使います。空振りでも論理 tick を1回消費します。このステージで名前付き呼び出しが解放されている必要があります。"
  },
  "syntax": "module.attack(angle)",
  "requirements": {
    "allow_named_calls": true,
    "module_behavior": "MeleeModule"
  }
}
